{"$schema":"https://cdn.jsdelivr.net/gh/forge-arcana/kod-data@main/schema/yields.schema.json","dataset":"yields","base":"USD","date":"2026-07-28","updated":"2026-07-29T19:03:29.482Z","sources":["us-treasury"],"sourcesMeta":{"us-treasury":{"date":"2026-07-28"}},"curves":{"US":{"unit":"percent","tenors":{"1M":3.76,"1.5M":3.86,"2M":3.9,"3M":3.9,"4M":4.02,"6M":4.07,"1Y":4.09,"2Y":4.26,"3Y":4.31,"5Y":4.35,"7Y":4.47,"10Y":4.61,"20Y":5.11,"30Y":5.09}}}}